{
  "schema_version": "1.0",
  "updated": "2026-08-07",
  "note": "运动户外×场景×光线对照（健身/露营/骑行/球类）。结构/折叠形态一致性是命门；避免医疗/治疗暗示（合规参考 compliance.json 运动器材）。",
  "groups": {
    "健身": ["fitness", "yoga_mat", "dumbbell"],
    "露营": ["tent", "camping_light", "chair"],
    "骑行球类": ["bike", "ball"]
  },
  "items": [
    {"id": "fitness", "name": "健身器材（跑步机/椭圆机）", "group": "健身", "properties": "结构，电子屏，安全细节", "scenes": ["健身房", "居家健身角", "落地窗光"], "light": "明亮窗光+器材屏幕光", "prompt_zh": "跑步机结构稳固，履带转动平稳，屏幕显示清晰，健身房落地窗明亮光", "avoid": "结构变形；屏幕乱码；运动动作变形", "negative": ["结构变形", "屏幕乱码"], "tags": ["健身", "器材", "明亮"]},
    {"id": "yoga_mat", "name": "瑜伽垫", "group": "健身", "properties": "防滑纹理，厚度，卷起形态", "scenes": ["瑜伽室", "居家", "落地窗前"], "light": "大窗光，通透", "prompt_zh": "瑜伽垫防滑纹理清晰，铺开平整，卷起收纳自然，瑜伽室落地窗光", "avoid": "纹理糊；卷边变形", "negative": ["纹理模糊"], "tags": ["瑜伽", "防滑", "通透"]},
    {"id": "dumbbell", "name": "哑铃/壶铃", "group": "健身", "properties": "材质（铸铁/包胶），握感，重量标识", "scenes": ["健身房", "居家健身角", "硬朗光"], "light": "硬朗侧光，力量感", "prompt_zh": "哑铃包胶材质质感，握持有力，重量标识清晰，健身房硬朗侧光", "avoid": "材质错误；标识错乱；动作变形", "negative": ["材质错误", "标识错乱"], "tags": ["哑铃", "力量", "硬朗"]},
    {"id": "tent", "name": "帐篷", "group": "露营", "properties": "结构，折叠形态，防水面料", "scenes": ["山间营地", "草地", "森林"], "light": "晨光/营灯暖光", "prompt_zh": "帐篷快速展开，铝合金支架稳固，防水面料质感，山间营地晨光氛围", "avoid": "支架变形；篷布褶皱失真", "negative": ["支架变形"], "tags": ["帐篷", "露营", "户外"]},
    {"id": "camping_light", "name": "露营灯/头灯", "group": "露营", "properties": "灯光色温，续航显示，防水", "scenes": ["夜晚营地", "帐篷内", "户外夜行"], "light": "灯自身发光+暗环境", "prompt_zh": "露营灯暖光晕染营地，亮度柔和，夜晚户外安静氛围", "avoid": "光效过曝；灯体变形", "negative": ["光效过曝"], "tags": ["露营灯", "夜晚", "暖光"]},
    {"id": "chair", "name": "户外椅/折叠椅", "group": "露营", "properties": "折叠结构，承重，面料", "scenes": ["营地", "河边", "草坪"], "light": "自然光+傍晚暖光", "prompt_zh": "折叠椅展开稳固，承重支撑，帆布面料质感，河边傍晚自然光", "avoid": "折叠形态错误；支撑变形", "negative": ["折叠形态错误"], "tags": ["户外椅", "折叠", "营地"]},
    {"id": "bike", "name": "自行车/骑行装备", "group": "骑行球类", "properties": "车架材质，变速系统，轮组", "scenes": ["公路", "山道", "城市骑行道"], "light": "自然光+动感", "prompt_zh": "公路自行车车架轻量，变速顺滑，轮组转动流畅，公路自然光骑行", "avoid": "车架变形；轮组错乱；骑行姿态变形", "negative": ["车架变形", "轮组错乱"], "tags": ["骑行", "车架", "动感"]},
    {"id": "ball", "name": "球类（篮球/足球）", "group": "骑行球类", "properties": "表皮纹理，logo，弹跳", "scenes": ["球场", "街头", "体育馆"], "light": "球馆灯光+自然光", "prompt_zh": "篮球表皮纹理清晰，logo鲜明，弹跳有力，球馆灯光动感氛围", "avoid": "球体变形；纹理错乱", "negative": ["球体变形"], "tags": ["球类", "动感", "球场"]}
  ]
}
