{
  "schema_version": "1.0",
  "updated": "2026-08-07",
  "note": "宠物用品×场景×光线对照（粮/砂/玩具/窝/牵引）。宠物形象一致性是命门；处方粮/治病宣称需资质。",
  "groups": {
    "喂养": ["petfood", "petfood2"],
    "卫生": ["litter", "petclean"],
    "玩具窝具": ["pettoys", "petbed", "leash"]
  },
  "items": [
    {"id": "petfood", "name": "猫粮/狗粮", "group": "喂养", "properties": "颗粒形态，包装，配方标注", "scenes": ["温馨厨房", "宠物喂食区", "晨光"], "light": "柔光暖调，温馨", "prompt_zh": "猫粮颗粒饱满均匀，宠物进食自然，晨光温馨厨房氛围", "avoid": "颗粒形态失真；包装变形；功效暗示（治病/处方需资质）", "negative": ["颗粒变形", "包装变形", "功效暗示"], "tags": ["猫粮", "喂养", "温馨"]},
    {"id": "petfood2", "name": "宠物零食/罐头", "group": "喂养", "properties": "质地，包装，开罐", "scenes": ["喂食互动", "厨房", "训练场景"], "light": "自然光+互动氛围", "prompt_zh": "宠物罐头肉质细腻，开罐香气感，宠物期待互动，自然光温馨氛围", "avoid": "质地失真；包装变形", "negative": ["质地失真"], "tags": ["零食", "罐头", "互动"]},
    {"id": "litter", "name": "猫砂", "group": "卫生", "properties": "颗粒形态，结团效果，除臭", "scenes": ["猫砂盆", "居家角落", "日常"], "light": "日常柔光", "prompt_zh": "猫砂颗粒细腻，结团紧实，猫咪使用自然，居家柔光日常氛围", "avoid": "结团效果夸张；颗粒失真", "negative": ["结团失真"], "tags": ["猫砂", "卫生", "日常"]},
    {"id": "petclean", "name": "宠物洗护用品", "group": "卫生", "properties": "包装，泡沫，温和", "scenes": ["浴室", "宠物洗澡", "户外"], "light": "浴室柔光+水汽", "prompt_zh": "宠物洗护泡沫绵密，洗澡互动自然，浴室柔光水汽氛围", "avoid": "宠物湿身变形；泡沫失真", "negative": ["宠物变形"], "tags": ["洗护", "洗澡", "泡沫"]},
    {"id": "pettoys", "name": "宠物玩具", "group": "玩具窝具", "properties": "材质（硅胶/毛绒/绳结），形态，互动", "scenes": ["居家客厅", "宠物玩耍", "公园"], "light": "自然光，活泼", "prompt_zh": "宠物玩具材质柔软，宠物咬玩互动自然，居家客厅自然光活泼氛围", "avoid": "玩具变形；宠物嘴部变形", "negative": ["玩具变形", "宠物变形"], "tags": ["玩具", "互动", "活泼"]},
    {"id": "petbed", "name": "宠物窝/垫", "group": "玩具窝具", "properties": "材质（棉/绒），可拆洗，尺寸", "scenes": ["居家角落", "卧室", "阳台暖光"], "light": "暖光，慵懒温馨", "prompt_zh": "宠物窝绒面柔软，宠物蜷缩入窝慵懒，阳台暖光温馨氛围", "avoid": "窝形塌陷；尺寸失真；宠物变形", "negative": ["窝形塌陷"], "tags": ["宠物窝", "慵懒", "暖光"]},
    {"id": "leash", "name": "牵引绳/胸背", "group": "玩具窝具", "properties": "材质（尼龙/皮），扣具，长度", "scenes": ["公园", "街头遛狗", "户外"], "light": "自然光，户外感", "prompt_zh": "牵引绳尼龙织带结实，扣具顺滑，户外遛狗自然光氛围", "avoid": "扣具变形；宠物变形", "negative": ["扣具变形"], "tags": ["牵引", "户外", "结实"]}
  ]
}
