{
  "schema_version": "1.0",
  "updated": "2026-08-07",
  "note": "家居×场景×光线对照。按品类分组，含中文提示词。造型/材质/尺寸比例一致性是命门；场景=使用空间（家是最大的场景舞台）。",
  "groups": {
    "客厅": ["sofa", "carpet", "curtain", "floorlamp"],
    "卧室": ["bedding", "mattress"],
    "餐厨": ["dining", "cookware", "tableware"],
    "收纳装饰": ["storage", "decor", "aroma"],
    "卫浴/其他": ["bath", "garden"]
  },
  "items": [
    {"id": "sofa", "name": "沙发", "group": "客厅", "properties": "面料/皮质，坐感，造型线条", "scenes": ["客厅午后", "落地窗光", "极简客厅"], "light": "窗光+柔光，舒适氛围", "prompt_zh": "沙发面料质感细腻，坐感舒适回弹，午后落地窗光洒在客厅", "avoid": "面料质感错误（皮变布）；比例失调", "negative": ["面料质感错误", "比例失调"], "tags": ["客厅", "坐感", "窗光"]},
    {"id": "carpet", "name": "地毯", "group": "客厅", "properties": "绒面，图案纹理，脚感", "scenes": ["客厅", "阅读角", "暖光居家"], "light": "顶光+柔光，纹理清晰", "prompt_zh": "地毯绒面柔软，编织纹理清晰，暖光客厅阅读角氛围", "avoid": "图案错乱；绒面糊", "negative": ["图案错乱", "纹理模糊"], "tags": ["地毯", "纹理", "客厅"]},
    {"id": "curtain", "name": "窗帘", "group": "客厅", "properties": "垂坠，遮光/透光，褶皱", "scenes": ["窗边", "晨光", "风拂动"], "light": "窗光+逆光，透光感", "prompt_zh": "窗帘垂坠自然，微风吹拂轻摆，晨光透过纱层洒入室内", "avoid": "褶皱生硬；透光效果失真", "negative": ["褶皱生硬"], "tags": ["窗帘", "垂坠", "晨光"]},
    {"id": "floorlamp", "name": "灯具", "group": "客厅", "properties": "造型设计，光色，材质", "scenes": ["夜晚客厅", "阅读角", "暖光卧室"], "light": "灯自身发光+环境暗，光感是主角", "prompt_zh": "落地灯造型简约，暖光晕染角落，夜晚客厅安静氛围", "avoid": "光效夸张；灯具变形", "negative": ["灯具变形", "光效过曝"], "tags": ["灯具", "暖光", "夜晚"]},
    {"id": "bedding", "name": "床品四件套", "group": "卧室", "properties": "面料支数，亲肤，颜色花纹", "scenes": ["卧室晨光", "铺床整理", "北欧卧室"], "light": "晨光+柔光，干净松弛感", "prompt_zh": "床品面料亲肤垂顺，花纹清晰，晨光洒在铺好的床面，干净松弛", "avoid": "花纹错乱；褶皱过度显乱", "negative": ["花纹错乱", "褶皱过度"], "tags": ["床品", "晨光", "卧室"]},
    {"id": "mattress", "name": "床垫", "group": "卧室", "properties": "厚度，支撑感，面料", "scenes": ["卧室", "展示间", "按压演示"], "light": "柔光+侧光，结构清晰", "prompt_zh": "床垫厚度饱满，按压回弹质感，展示间柔光下结构清晰", "avoid": "厚度比例失真；回弹夸张", "negative": ["比例失真"], "tags": ["床垫", "回弹", "卧室"]},
    {"id": "dining", "name": "餐桌椅", "group": "餐厨", "properties": "木质/金属，造型，尺寸", "scenes": ["餐厅", "家庭聚餐", "北欧厨房"], "light": "自然光+顶光，温馨", "prompt_zh": "实木餐桌纹理温润，餐椅线条简洁，自然光餐厅家庭氛围", "avoid": "木纹失真；比例失调", "negative": ["木纹失真", "比例失调"], "tags": ["餐桌", "实木", "家庭"]},
    {"id": "cookware", "name": "锅具/厨房用品", "group": "餐厨", "properties": "材质（不粘/铸铁/不锈钢），受热，把手", "scenes": ["厨房", "烹饪过程", "炉火"], "light": "厨房光+炉火暖光", "prompt_zh": "不粘锅表面光滑，食材下锅滋滋作响，厨房炉火暖光", "avoid": "锅体变形；把手错位；反光过曝", "negative": ["锅体变形", "反光过曝"], "tags": ["锅具", "厨房", "烹饪"]},
    {"id": "tableware", "name": "餐具/杯具", "group": "餐厨", "properties": "陶瓷/玻璃，釉面，图案", "scenes": ["餐桌", "阳光早餐", "极简厨房"], "light": "窗光+逆光，通透感", "prompt_zh": "陶瓷餐具釉面温润，玻璃杯通透反光，阳光早餐餐桌", "avoid": "釉面失真；杯具变形；图案错乱", "negative": ["杯具变形", "图案错乱"], "tags": ["餐具", "陶瓷", "阳光"]},
    {"id": "storage", "name": "收纳/置物架", "group": "收纳装饰", "properties": "结构，材质，承重感", "scenes": ["极简玄关", "衣帽间", "书房"], "light": "柔光，整洁感", "prompt_zh": "置物架结构稳固，物品摆放整齐，极简玄关柔光整洁氛围", "avoid": "结构变形；物品错乱", "negative": ["结构变形"], "tags": ["收纳", "极简", "整洁"]},
    {"id": "decor", "name": "装饰画/摆件", "group": "收纳装饰", "properties": "画面内容，框体，材质", "scenes": ["墙面", "射灯", "极简客厅"], "light": "射灯+氛围光，聚焦", "prompt_zh": "装饰画色彩构图精致，射灯聚焦墙面，极简客厅艺术氛围", "avoid": "画面内容错乱；框体变形", "negative": ["画面错乱", "框体变形"], "tags": ["装饰", "艺术", "射灯"]},
    {"id": "aroma", "name": "香薰/蜡烛", "group": "收纳装饰", "properties": "瓶身/蜡面，火焰，烟雾", "scenes": ["夜晚卧室", "浴室", "阅读角"], "light": "烛光+暗环境，氛围主角", "prompt_zh": "香薰蜡烛火焰摇曳，蜡面平整，烛光晕染夜晚卧室静谧氛围", "avoid": "火焰变形；烟雾夸张；瓶身变形", "negative": ["火焰变形", "瓶身变形"], "tags": ["香薰", "烛光", "夜晚"]},
    {"id": "bath", "name": "卫浴用品", "group": "卫浴/其他", "properties": "陶瓷/五金，水珠，光泽", "scenes": ["浴室", "水汽", "窗光"], "light": "水汽+窗光，干净感", "prompt_zh": "卫浴陶瓷表面光洁，水珠凝结滑落，浴室水汽窗光干净氛围", "avoid": "五金变形；水珠失真", "negative": ["五金变形"], "tags": ["卫浴", "水汽", "洁净"]},
    {"id": "garden", "name": "阳台花园用品", "group": "卫浴/其他", "properties": "植物，花盆，户外材质", "scenes": ["阳台晨光", "花园", "户外下午"], "light": "自然光，生机感", "prompt_zh": "花盆材质自然，绿植生机盎然，阳台晨光花园氛围", "avoid": "植物形态失真；花盆变形", "negative": ["植物变形"], "tags": ["花园", "绿植", "晨光"]}
  ]
}
