{
  "schema_version": "1.0",
  "updated": "2026-08-07",
  "note": "珠宝钟表×场景×光线对照（金/银/玉/珍珠/表）。金属颜色/宝石位置/链体结构一致性是命门；火彩不夸张到失真。",
  "groups": {
    "金属饰品": ["necklace", "ring", "bracelet"],
    "宝石玉石": ["jade", "pearl"],
    "钟表": ["watch_j"]
  },
  "items": [
    {"id": "necklace", "name": "项链", "group": "金属饰品", "properties": "链体结构，吊坠，金属颜色", "scenes": ["颈部佩戴", "灯光展示台", "礼服场景"], "light": "柔光+点光源，火彩", "prompt_zh": "钻石项链在光下折射璀璨火彩，链体金属质感细腻，颈部佩戴柔光特写", "avoid": "链体错乱；宝石错位；金属颜色失真", "negative": ["链体错乱", "宝石错位", "颜色失真"], "tags": ["项链", "火彩", "佩戴"]},
    {"id": "ring", "name": "戒指", "group": "金属饰品", "properties": "戒圈，镶嵌，工艺", "scenes": ["手部特写", "求婚场景", "灯光展示"], "light": "点光源+微距光，宝石闪光", "prompt_zh": "戒指镶嵌工艺精致，宝石在光下闪烁，手部微距柔光特写", "avoid": "戒圈变形；宝石数量错误；手部变形", "negative": ["戒圈变形", "宝石错位", "手部变形"], "tags": ["戒指", "镶嵌", "微距"]},
    {"id": "bracelet", "name": "手镯/手链", "group": "金属饰品", "properties": "环体，搭扣，材质", "scenes": ["腕部特写", "礼服场景", "展示台"], "light": "柔光+金属反光", "prompt_zh": "手镯金属光泽温润，搭扣精致，腕部柔光特写优雅氛围", "avoid": "环体变形；搭扣错乱", "negative": ["环体变形"], "tags": ["手镯", "腕部", "优雅"]},
    {"id": "jade", "name": "玉石/翡翠", "group": "宝石玉石", "properties": "种水质地，颜色分布，雕工", "scenes": ["中式展示", "茶室", "射灯展柜"], "light": "射灯+暖光，通透感", "prompt_zh": "翡翠种水通透，颜色分布自然，雕工细腻，茶室射灯暖光展示", "avoid": "颜色失真；质地糊；雕工错乱", "negative": ["颜色失真", "雕工错乱"], "tags": ["翡翠", "国风", "通透"]},
    {"id": "pearl", "name": "珍珠饰品", "group": "宝石玉石", "properties": "珠形圆润，光泽晕彩，排列", "scenes": ["礼服场景", "优雅晚宴", "柔光展示"], "light": "柔光，珠光晕彩", "prompt_zh": "珍珠圆润饱满，光泽晕彩温润，排列均匀，晚宴柔光优雅氛围", "avoid": "珠形变形；光泽失真；排列错乱", "negative": ["珠形变形", "排列错乱"], "tags": ["珍珠", "晕彩", "优雅"]},
    {"id": "watch_j", "name": "手表", "group": "钟表", "properties": "表盘，指针，表带，机芯可见", "scenes": ["腕部特写", "商务场景", "灯光展示"], "light": "柔光+表盘反光", "prompt_zh": "手表表盘刻度清晰，指针顺滑走动，金属表带质感，腕部柔光特写", "avoid": "表盘乱码；指针错乱；表带变形", "negative": ["表盘乱码", "指针错乱"], "tags": ["手表", "表盘", "商务"]}
  ]
}
