{
  "schema_version": "1.0",
  "updated": "2026-08-07",
  "note": "面料×场景×光线对照（30组）。groups 为分类索引；items 按 id 存储。提示词全部中文。检索：先查 index.json 定位，再按 id/tags 取条目，不必全量加载。",
  "groups": {
    "光泽感": ["satin", "silk", "velvet", "chiffon", "lace", "tulle", "organza", "sequin"],
    "哑光自然": ["cotton", "linen", "denim", "corduroy", "tweed", "wool", "cashmere", "knit", "fleece"],
    "硬挺结构": ["leather", "fur", "worsted", "gabardine", "down", "techshell"],
    "运动弹性": ["activewear", "quickdry"],
    "特殊氛围": ["crochet", "reflective", "velvet2", "cottonlinen", "tencel"]
  },
  "items": [
    {"id": "satin", "name": "缎面", "alt": "醋酸", "group": "光泽感", "properties": "高光泽、流动性强、随动作产生波浪高光", "scenes": ["大理石美术馆", "酒店大堂", "水面倒影", "玻璃幕墙前"], "light": "柔光箱主光 + 硬质轮廓光勾边缘，让光泽拉出光带", "prompt_zh": "缎面面料呈现液态光泽，光线在面料表面流动，随着她的动作，高光如光带般在面料上滑动", "avoid": "光泽过曝成塑料感", "negative": ["塑料感光泽", "高光过曝"], "tags": ["光泽", "礼服", "连衣裙"]},
    {"id": "silk", "name": "丝绸", "alt": "", "group": "光泽感", "properties": "细腻珠光、垂坠、微透光", "scenes": ["中式庭院", "茶室", "旧式木窗+纱帘"], "light": "大面积柔光窗光，侧逆光透出丝绸通透感", "prompt_zh": "细腻丝绸带有柔和珠光，逆光时微微透光，柔和窗光透过纱帘均匀洒下", "avoid": "光太硬显皱褶廉价", "negative": ["生硬阴影", "廉价褶皱"], "tags": ["光泽", "国风", "旗袍"]},
    {"id": "velvet", "name": "丝绒", "alt": "", "group": "光泽感", "properties": "哑光绒毛+深色区域吸收光线，最吃方向光", "scenes": ["复古剧院", "老式酒吧", "深色木质书房"], "light": "单侧硬光或烛光氛围，光比大，绒毛见绒感", "prompt_zh": "丝绒面料丰厚有深度，方向光斜扫绒毛表面，深褶处明暗对比强烈，暖琥珀色氛围光", "avoid": "光太平均变普通布，保持高对比", "negative": ["平淡光线"], "tags": ["哑光", "复古", "冬装"]},
    {"id": "chiffon", "name": "雪纺", "alt": "", "group": "光泽感", "properties": "轻薄半透、随风飘动、层次感", "scenes": ["海边", "花园", "天台"], "light": "逆光+柔光，突出半透明层次", "prompt_zh": "轻薄雪纺在微风中飘动，多层半透明裙摆，逆光下边缘微微透光发亮", "avoid": "必须写风/飘动，否则像挂在人身上", "negative": ["面料僵硬", "毫无飘动"], "tags": ["飘逸", "春夏", "度假"]},
    {"id": "lace", "name": "蕾丝", "alt": "", "group": "光泽感", "properties": "镂空花纹，细节密集，最容易翻车（花纹错乱）", "scenes": ["纱帘花影", "花园洋房", "阳光斑驳窗边"], "light": "柔和散射光+花影投在面料上，纹理对话", "prompt_zh": "蕾丝镂空花纹清晰不变形，柔和斑驳光线透过纱帘洒下，花叶投影落在面料上", "avoid": "花纹乱；必须高清细节参考图", "negative": ["蕾丝花纹错乱", "花纹粘连"], "tags": ["细节", "婚纱", "法式"]},
    {"id": "tulle", "name": "网纱", "alt": "", "group": "光泽感", "properties": "蓬松、多层、蓬裙骨架感", "scenes": ["舞台", "秀场后台", "城堡楼梯"], "light": "顶光+背光，让纱层透出光晕", "prompt_zh": "多层网纱蓬松有体积感，半透明纱层透出背光，面料边缘泛出柔光晕", "avoid": "层数容易塌", "negative": ["网纱塌陷", "层数扁平"], "tags": ["蓬松", "礼服", "舞台"]},
    {"id": "organza", "name": "欧根纱", "alt": "", "group": "光泽感", "properties": "挺括半透、硬挺光泽、定型感", "scenes": ["艺术画廊", "极简白空间"], "light": "硬质侧光，强调挺括轮廓线", "prompt_zh": "欧根纱挺括有型，结构感强，褶皱线条清晰锐利，冷调画廊灯光", "avoid": "挺括感丢失变雪纺", "negative": ["面料绵软无力"], "tags": ["挺括", "设计款"]},
    {"id": "sequin", "name": "珠片亮片", "alt": "", "group": "光泽感", "properties": "点状高光、闪动感", "scenes": ["夜景街道霓虹", "派对空间", "舞台"], "light": "点光源（霓虹/聚光灯）+轻微动态，闪片跳动", "prompt_zh": "珠片连衣裙随着动作闪烁细碎光芒，霓虹灯光在每片珠片上反射跳动", "avoid": "闪片糊成一片", "negative": ["珠片模糊", "闪光粘连成片"], "tags": ["光泽", "派对", "夜店"]},
    {"id": "cotton", "name": "棉", "alt": "", "group": "哑光自然", "properties": "哑光、亲肤、有自然褶皱", "scenes": ["居家", "咖啡馆", "街角日常"], "light": "自然窗光或阴天柔光，不要舞台感", "prompt_zh": "柔软哑光棉质，自然褶皱，真实亲肤的织物纹理，自然日常光", "avoid": "无，棉最稳，兜底方案", "negative": [], "tags": ["日常", "通勤", "基础款"]},
    {"id": "linen", "name": "亚麻", "alt": "", "group": "哑光自然", "properties": "粗织纹理、自然褶皱感、透气", "scenes": ["海边度假", "地中海小镇", "原木家居"], "light": "上午9-10点黄金角度斜射光，纹理立现", "prompt_zh": "天然亚麻，编织纹理清晰可见，自然放松的褶皱，暖色晨光斜射在面料上", "avoid": "褶皱太多显邋遢", "negative": ["褶皱过度"], "tags": ["度假", "春夏", "自然"]},
    {"id": "denim", "name": "牛仔", "alt": "", "group": "哑光自然", "properties": "硬挺、洗水做旧、缝线五金细节", "scenes": ["工业砖墙", "混凝土", "机车车库", "城市街头"], "light": "硬朗侧光或蓝调时刻，强调硬质感", "prompt_zh": "原色牛仔，靛蓝水洗纹路清晰，斜纹织法硬挺，硬朗侧光打在混凝土背景上", "avoid": "水洗纹路会乱", "negative": ["水洗纹路错乱", "走线错误"], "tags": ["街头", "硬挺", "休闲"]},
    {"id": "corduroy", "name": "灯芯绒", "alt": "", "group": "哑光自然", "properties": "纵向条纹绒面，复古感", "scenes": ["复古书店", "秋日公园长椅", "旧城街道"], "light": "暖色低角度光（下午/黄昏），条纹绒感明显", "prompt_zh": "灯芯绒面料带细腻纵向条绒，复古温暖感，低角度黄昏暖光强调条绒纹理", "avoid": "条纹方向乱", "negative": ["条绒纹理方向错乱"], "tags": ["复古", "秋冬"]},
    {"id": "tweed", "name": "粗花呢", "alt": "", "group": "哑光自然", "properties": "颗粒混色、编织肌理、英伦感", "scenes": ["英伦街道", "猎场", "老牌俱乐部", "秋季枫林"], "light": "阴天散射光或晨雾光，颗粒感柔和呈现", "prompt_zh": "人字纹粗花呢，羊毛颗粒混色质感，阴天柔光下纹理细腻呈现，经典英伦氛围", "avoid": "颗粒糊掉", "negative": ["粗花呢纹理模糊"], "tags": ["英伦", "秋冬", "西装"]},
    {"id": "wool", "name": "羊毛", "alt": "", "group": "哑光自然", "properties": "温暖、厚实、垂坠有重量", "scenes": ["冬夜街头", "壁炉边", "雪景咖啡馆"], "light": "暖色侧光+冷色环境对比（窗外冷、室内暖）", "prompt_zh": "厚实羊毛大衣，垂坠有分量，室内暖光与窗外冷蓝色光形成对比", "avoid": "显臃肿，动作避免正面僵硬站立", "negative": [], "tags": ["冬装", "大衣", "温暖"]},
    {"id": "cashmere", "name": "羊绒", "alt": "", "group": "哑光自然", "properties": "极细软、微绒光、高级哑光", "scenes": ["晨雾街道+咖啡灯", "木质暖宅", "雪山缆车"], "light": "低照度暖光（咖啡店灯光/壁灯），光比柔和", "prompt_zh": "细腻羊绒表面泛着若有若无的绒光，低照度暖光氛围，温馨私密感", "avoid": "绒光若有若无，过曝就廉价", "negative": [], "tags": ["高级", "秋冬", "轻奢"]},
    {"id": "knit", "name": "针织", "alt": "", "group": "哑光自然", "properties": "罗纹/麻花纹理，弹性，慵懒感", "scenes": ["居家沙发", "书店", "街头随拍"], "light": "柔和窗光，暖调", "prompt_zh": "粗棒针针织毛衣，罗纹针法清晰，温馨柔和光线，慵懒居家氛围", "avoid": "针法纹路错乱", "negative": ["针织纹路错乱"], "tags": ["慵懒", "居家", "秋冬"]},
    {"id": "fleece", "name": "摇粒绒", "alt": "", "group": "哑光自然", "properties": "短绒蓬松、户外感", "scenes": ["山间营地", "雪场缆车", "露营灯下"], "light": "冷色户外光+暖色营地灯对比", "prompt_zh": "蓬松摇粒绒，短绒颗粒细腻，营地暖光与山间冷空气感形成对比", "avoid": "绒毛糊成马赛克", "negative": ["摇粒绒纹理模糊"], "tags": ["户外", "冬装", "休闲"]},
    {"id": "leather", "name": "皮革", "alt": "", "group": "硬挺结构", "properties": "高反光+硬挺，划痕纹理", "scenes": ["钢铁厂房", "机车俱乐部", "摩天楼玻璃幕墙", "夜店"], "light": "硬光+强轮廓光，表面反光带", "prompt_zh": "细腻粒面皮革夹克，硬朗轮廓光勾勒身形，表面反光带随动作流动", "avoid": "皮革变橡胶感", "negative": ["橡胶塑料质感"], "tags": ["硬挺", "机车", "街头"]},
    {"id": "fur", "name": "皮草", "alt": "", "group": "硬挺结构", "properties": "长毛、体积感、毛流方向", "scenes": ["雪景", "复古剧院门口", "豪华酒店"], "light": "逆光+侧光，毛尖透光发亮", "prompt_zh": "奢华皮草大衣，毛流方向统一，逆光下毛尖透光发亮，冬日华贵氛围", "avoid": "毛流错乱/糊；参考图给毛流特写", "negative": ["毛流错乱", "皮草纹理模糊"], "tags": ["华贵", "冬装", "高客单"]},
    {"id": "worsted", "name": "精纺西装面料", "alt": "", "group": "硬挺结构", "properties": "挺括、垂坠、结构线条", "scenes": ["摩天楼办公室", "金融街", "高端会议室", "蓝调时刻天台"], "light": "硬朗轮廓光+冷调环境光", "prompt_zh": "挺括精纺羊毛西装，剪裁线条利落，轮廓光勾勒肩线，冷调蓝调时刻氛围", "avoid": "西装显撑不住", "negative": ["版型松垮", "不合身"], "tags": ["通勤", "商务", "高级"]},
    {"id": "gabardine", "name": "风衣面料", "alt": "", "group": "硬挺结构", "properties": "斜纹密织、防风、硬挺飘动", "scenes": ["雨夜街道", "机场", "秋季街头"], "light": "阴天冷光+路灯暖光混合", "prompt_zh": "斜纹密织风衣，结构挺括，风吹起衣摆，阴冷街光与暖色路灯混合", "avoid": "飘动要写风，否则僵直", "negative": [], "tags": ["风衣", "秋季", "通勤"]},
    {"id": "down", "name": "羽绒", "alt": "", "group": "硬挺结构", "properties": "充绒蓬松、绗缝格纹", "scenes": ["雪场", "冰湖", "极寒街头"], "light": "冷调高光（雪地反光）+暖色围巾点缀", "prompt_zh": "蓬松羽绒服，绗缝格纹清晰饱满，雪地反光呈冷调高光，暖色点缀提亮", "avoid": "绗缝走线乱、充绒塌陷", "negative": ["绗缝走线错乱", "羽绒塌陷"], "tags": ["冬装", "户外", "保暖"]},
    {"id": "techshell", "name": "冲锋衣科技面料", "alt": "", "group": "硬挺结构", "properties": "防水、微光泽、机能感", "scenes": ["雨中山脊", "城市天台", "工业天台"], "light": "阴天散射光+雨滴反光", "prompt_zh": "科技冲锋衣面料，表面水珠成珠滚落，阴天散射光，机能感十足", "avoid": "光泽别做成塑料", "negative": ["塑料感光泽"], "tags": ["机能", "户外", "防水"]},
    {"id": "activewear", "name": "瑜伽/弹力面料", "alt": "", "group": "运动弹性", "properties": "高弹、贴合、吸湿纹理", "scenes": ["健身房", "海边跑道", "瑜伽室落地窗前"], "light": "大窗光+高调明亮", "prompt_zh": "高弹面料贴合身体曲线，微细网眼纹理，明亮通透的落地窗光", "avoid": "褶皱乱，动作要自然", "negative": ["多余褶皱"], "tags": ["运动", "弹力", "春夏"]},
    {"id": "quickdry", "name": "速干运动面料", "alt": "", "group": "运动弹性", "properties": "轻薄、网眼、透气", "scenes": ["户外跑道", "球场", "城市骑行"], "light": "上午阳光，运动感", "prompt_zh": "轻薄速干运动面料，网眼拼接细节，动感十足，清晨明亮阳光", "avoid": "网眼纹理糊", "negative": ["网眼纹理错乱"], "tags": ["运动", "速干"]},
    {"id": "crochet", "name": "镂空钩针", "alt": "", "group": "特殊氛围", "properties": "手工感、镂空孔洞、度假感（最容易翻车之一）", "scenes": ["海边白墙", "泳池边", "地中海小巷"], "light": "明亮高调阳光，阴影透孔洞", "prompt_zh": "手工钩针编织，镂空孔洞均匀一致，明亮地中海阳光，光影透过孔洞", "avoid": "孔洞错乱；务必高清参考图", "negative": ["钩针孔洞错乱"], "tags": ["度假", "手工", "春夏"]},
    {"id": "reflective", "name": "反光面料", "alt": "", "group": "特殊氛围", "properties": "反光条/涂层，夜跑机能", "scenes": ["夜间街道", "隧道", "城市夜景"], "light": "车灯/路灯直射，反光条爆亮", "prompt_zh": "反光条在路灯直射下明亮醒目，深夜城市街道，高对比夜景", "avoid": "反光做成自发光，注意光源方向自洽", "negative": [], "tags": ["夜跑", "机能"]},
    {"id": "velvet2", "name": "天鹅绒（家居用法）", "alt": "", "group": "特殊氛围", "properties": "绒面+垂坠", "scenes": ["秋冬家宴", "壁炉", "深色法式公寓"], "light": "烛光/壁炉火光，低色温暖光", "prompt_zh": "丝绒睡袍在壁炉火光中泛着暖光，深色奢华室内，跳动的琥珀色光芒", "avoid": "火光闪烁别拍成频闪", "negative": ["画面闪烁"], "tags": ["家居", "法式", "冬装"]},
    {"id": "cottonlinen", "name": "麻棉混纺", "alt": "", "group": "特殊氛围", "properties": "棉的软+麻的纹理", "scenes": ["茶室", "禅意庭院", "日式住宅"], "light": "木格栅投影光，光影是主角", "prompt_zh": "棉麻混纺，柔软中带竹节纹理，障子纸门投下木格栅光影", "avoid": "纹理糊", "negative": ["竹节纹理模糊"], "tags": ["禅意", "国风", "日式"]},
    {"id": "tencel", "name": "天丝/莱赛尔", "alt": "", "group": "特殊氛围", "properties": "垂坠+微凉感+细腻光泽（介于棉和缎之间）", "scenes": ["极简北欧家居", "白色空间", "晨光卧室"], "light": "大面柔光，通透干净", "prompt_zh": "天丝面料垂坠顺滑，带细腻光泽，极简白色空间，通透干净的晨光", "avoid": "光泽过头变缎面，控制高光", "negative": [], "tags": ["垂坠", "极简", "春夏"]}
  ]
}
