{
  "schema_version": "1.0",
  "updated": "2026-08-07",
  "note": "汽车用品×场景×光线对照（膜/垫/载/养护）。形态/材质/贴合一致性是命门；功能演示不夸大。",
  "groups": {
    "内饰": ["footmat", "carseat", "airfresh"],
    "外饰养护": ["film", "cleaner", "charger"]
  },
  "items": [
    {"id": "footmat", "name": "脚垫", "group": "内饰", "properties": "TPE/皮革，防滑纹理，贴合裁剪", "scenes": ["车内", "装车场景", "干净座舱"], "light": "车内自然光+顶灯", "prompt_zh": "脚垫贴合装入车内，TPE材质防滑纹理清晰，车内自然光干净质感", "avoid": "贴合失真；纹理糊；尺寸不符", "negative": ["贴合失真", "纹理模糊"], "tags": ["脚垫", "内饰", "贴合"]},
    {"id": "carseat", "name": "儿童安全座椅", "group": "内饰", "properties": "结构，安全认证标识，面料", "scenes": ["车内后座", "装车演示", "家庭出行"], "light": "车内光+自然光", "prompt_zh": "安全座椅安装稳固，结构清晰，面料舒适，车内自然光家庭出行氛围", "avoid": "结构变形；标识错乱；宝宝形象变形", "negative": ["结构变形", "标识错乱"], "tags": ["安全座椅", "安全", "家庭"]},
    {"id": "airfresh", "name": "车载香薰/饰品", "group": "内饰", "properties": "造型设计，材质，安装方式", "scenes": ["车内出风口", "中控台", "夜间行车"], "light": "车内氛围光+夜景", "prompt_zh": "车载香薰造型精致，出风口安装稳固，夜间行车氛围光质感", "avoid": "造型变形；安装失真", "negative": ["造型变形"], "tags": ["香薰", "车内", "氛围"]},
    {"id": "film", "name": "车膜/改色膜", "group": "外饰养护", "properties": "颜色，光泽，贴膜效果", "scenes": ["贴膜车间", "户外车身", "光线下"], "light": "硬光+车身反光", "prompt_zh": "车膜颜色均匀，光泽顺滑，车身弧面反光自然，贴膜车间光线下质感", "avoid": "膜面气泡；颜色失真；反光过曝", "negative": ["膜面气泡", "颜色失真"], "tags": ["车膜", "光泽", "车身"]},
    {"id": "cleaner", "name": "养护剂/清洁用品", "group": "外饰养护", "properties": "瓶装，使用效果，泡沫/喷雾", "scenes": ["洗车场", "车库", "养护过程"], "light": "自然光+泡沫反光", "prompt_zh": "养护剂喷雾细腻，擦拭后表面光亮如新，洗车场自然光效果演示", "avoid": "效果夸张；瓶身变形", "negative": ["瓶身变形"], "tags": ["养护", "清洁", "效果"]},
    {"id": "charger", "name": "车载充电/支架", "group": "外饰养护", "properties": "接口，固定方式，指示灯", "scenes": ["车内中控", "驾驶位", "夜间"], "light": "车内光+指示灯", "prompt_zh": "车载支架固定稳固，手机放置自然，指示灯亮起，车内夜间氛围光", "avoid": "支架变形；接口错位", "negative": ["支架变形", "接口错位"], "tags": ["车载", "支架", "实用"]}
  ]
}
