{
  "schema_version": "1.0",
  "updated": "2026-08-07",
  "note": "鞋靴×场景×光线对照。鞋型/logo/配色/鞋底结构一致性是命门。",
  "groups": {
    "运动": ["sneaker", "running", "basketball"],
    "休闲": ["canvas", "slipon", "sandals"],
    "正装靴": ["leather_shoe", "boots", "heels"]
  },
  "items": [
    {"id": "sneaker", "name": "运动鞋/老爹鞋", "group": "运动", "properties": "鞋型轮廓，网面/革面拼接，鞋底科技", "scenes": ["街头", "球场", "城市夜景"], "light": "硬朗侧光+轮廓光，街头感", "prompt_zh": "运动鞋上脚行走，鞋底缓震回弹，网面透气拼接质感，街头跟拍硬朗侧光", "avoid": "鞋型变形；logo错乱；配色分布错误", "negative": ["鞋型变形", "logo错乱", "配色偏移"], "tags": ["运动鞋", "街头", "上脚"]},
    {"id": "running", "name": "跑步鞋", "group": "运动", "properties": "轻量，缓震中底，透气网面", "scenes": ["跑道", "晨跑街头", "公园"], "light": "晨光+自然光，动感", "prompt_zh": "跑步鞋轻量缓震，跑动中鞋底形变回弹，晨光跑道动感氛围", "avoid": "跑步姿态变形；中底结构错乱", "negative": ["鞋底结构错乱"], "tags": ["跑步", "晨光", "动感"]},
    {"id": "basketball", "name": "篮球鞋", "group": "运动", "properties": "高帮，包裹，耐磨大底", "scenes": ["球场", "室内球馆", "夜场灯光"], "light": "球馆灯光+硬光", "prompt_zh": "篮球鞋高帮包裹脚踝，急停变向抓地，球馆灯光下质感硬朗", "avoid": "急停动作变形；鞋型错误", "negative": ["鞋型变形"], "tags": ["篮球", "球馆", "硬朗"]},
    {"id": "canvas", "name": "帆布鞋", "group": "休闲", "properties": "帆布材质，简约，经典款", "scenes": ["文艺街道", "校园", "咖啡店"], "light": "自然柔光，日常感", "prompt_zh": "帆布鞋简约百搭，行走自然，文艺街角柔和自然光", "avoid": "帆布纹理糊；鞋型塌", "negative": ["帆布纹理模糊"], "tags": ["帆布", "文艺", "日常"]},
    {"id": "slipon", "name": "一脚蹬/乐福鞋", "group": "休闲", "properties": "无鞋带，一脚蹬，皮质/布面", "scenes": ["通勤街头", "办公室", "轻奢场所"], "light": "柔光+环境光，从容感", "prompt_zh": "乐福鞋一脚蹬穿脱方便，皮质质感细腻，通勤街头从容步伐", "avoid": "穿脱动作变形；皮质质感错误", "negative": ["材质错误"], "tags": ["乐福", "通勤", "从容"]},
    {"id": "sandals", "name": "凉鞋/拖鞋", "group": "休闲", "properties": "露趾，绑带/厚底，夏日感", "scenes": ["海边", "夏日街头", "泳池边"], "light": "明亮阳光，清爽", "prompt_zh": "凉鞋绑带设计简约，厚底舒适，海边阳光清爽夏日氛围", "avoid": "绑带变形；脚部变形", "negative": ["脚部变形"], "tags": ["凉鞋", "夏日", "清爽"]},
    {"id": "leather_shoe", "name": "皮鞋/正装鞋", "group": "正装靴", "properties": "头层皮，光泽，车缝线", "scenes": ["办公室", "金融街", "高端场所"], "light": "硬朗光+轮廓光，质感", "prompt_zh": "皮鞋头层皮光泽细腻，车缝线工整，金融街蓝调时刻硬朗质感", "avoid": "鞋型变形；缝线错乱；皮面划痕失真", "negative": ["缝线错乱", "材质错误"], "tags": ["皮鞋", "正装", "质感"]},
    {"id": "boots", "name": "靴子（马丁/工装）", "group": "正装靴", "properties": "高筒，硬挺，金属扣件", "scenes": ["工业风街道", "机车", "秋日街头"], "light": "硬光+轮廓光，酷感", "prompt_zh": "马丁靴硬挺有型，金属扣件质感，工业街道硬朗侧光酷感氛围", "avoid": "靴筒变形；扣件错乱", "negative": ["靴筒变形", "扣件错乱"], "tags": ["马丁靴", "硬挺", "酷"]},
    {"id": "heels", "name": "高跟鞋", "group": "正装靴", "properties": "跟型，线条，精致", "scenes": ["酒店", "红毯", "都市夜景"], "light": "柔光+轮廓光，优雅", "prompt_zh": "高跟鞋线条优雅，跟型精致，行走姿态从容，酒店暖光优雅氛围", "avoid": "跟型变形；脚部变形；行走姿态不稳", "negative": ["跟型变形", "脚部变形"], "tags": ["高跟", "优雅", "精致"]}
  ]
}
