{
  "schema_version": "1.0",
  "updated": "2026-08-07",
  "note": "母婴×场景×光线对照（奶粉/纸尿裤/玩具/推车/童装）。宝宝形象一致性+安全场景是命门；功效/安全宣称需资质（合规参考 compliance.json 母婴）。",
  "groups": {
    "喂养": ["milkpowder", "babyfood2"],
    "护理": ["diaper", "babycare"],
    "玩耍出行": ["toy", "stroller", "kidsclothes"]
  },
  "items": [
    {"id": "milkpowder", "name": "奶粉", "group": "喂养", "properties": "罐装包装，粉质，冲泡", "scenes": ["温馨厨房", "晨光餐桌", "育儿房"], "light": "柔光暖调，温馨", "prompt_zh": "奶粉罐身包装清晰，粉质细腻，冲泡溶解均匀，温馨晨光厨房氛围", "avoid": "包装变形；文字乱码；功效暗示（助长高/聪明禁止）", "negative": ["包装变形", "文字乱码", "功效暗示"], "tags": ["奶粉", "喂养", "温馨"]},
    {"id": "babyfood2", "name": "辅食/零食", "group": "喂养", "properties": "细腻质地，小包装，安全材质", "scenes": ["宝宝餐椅", "温馨厨房", "柔光餐桌"], "light": "柔光暖调", "prompt_zh": "辅食质地细腻，勺起顺滑，宝宝进食自然，温馨柔光氛围", "avoid": "宝宝面部变形；功效暗示", "negative": ["宝宝面部变形", "功效暗示"], "tags": ["辅食", "进食", "温馨"]},
    {"id": "diaper", "name": "纸尿裤", "group": "护理", "properties": "结构（腰围/防漏），吸收，柔软", "scenes": ["育儿房", "换尿布台", "温馨卧室"], "light": "柔和暖光，安全感", "prompt_zh": "纸尿裤腰围弹性贴合，表层柔软，结构清晰展示，育儿房温馨柔光", "avoid": "结构变形；图案错乱；吸收演示夸张", "negative": ["结构变形", "图案错乱"], "tags": ["纸尿裤", "护理", "柔软"]},
    {"id": "babycare", "name": "婴儿洗护/湿巾", "group": "护理", "properties": "温和配方，包装，使用便捷", "scenes": ["浴室", "育儿房", "外出场景"], "light": "柔光，温和感", "prompt_zh": "婴儿湿巾柔软亲肤，抽取顺畅，育儿房柔和光温和氛围", "avoid": "包装变形；质地失真", "negative": ["包装变形"], "tags": ["洗护", "温和", "湿巾"]},
    {"id": "toy", "name": "玩具", "group": "玩耍出行", "properties": "材质安全，色彩，功能（益智/声光）", "scenes": ["儿童房", "爬行垫", "公园草地"], "light": "明亮自然光，童趣", "prompt_zh": "玩具色彩明快，宝宝玩耍互动自然，儿童房明亮自然光童趣氛围", "avoid": "玩具变形；色彩失真；危险动作画面", "negative": ["玩具变形", "危险画面"], "tags": ["玩具", "童趣", "明亮"]},
    {"id": "stroller", "name": "婴儿推车", "group": "玩耍出行", "properties": "车架结构，折叠，遮阳棚", "scenes": ["公园", "小区", "林荫道"], "light": "自然光+树影", "prompt_zh": "推车推行平稳，折叠收纳顺畅，遮阳棚结构完整，公园晨光温馨氛围", "avoid": "车架变形；折叠形态错误；推行动作生硬", "negative": ["车架变形", "折叠形态错误"], "tags": ["推车", "出行", "公园"]},
    {"id": "kidsclothes", "name": "童装", "group": "玩耍出行", "properties": "纯棉，图案印花，版型", "scenes": ["儿童房", "公园", "亲子场景"], "light": "明亮自然光，童真", "prompt_zh": "童装纯棉柔软，印花清晰，宝宝穿着玩耍自然，公园自然光童真氛围", "avoid": "印花错乱；宝宝面部变形", "negative": ["印花错乱", "宝宝面部变形"], "tags": ["童装", "纯棉", "童真"]}
  ]
}
