{
  "schema_version": "1.0",
  "updated": "2026-08-07",
  "note": "食品×场景×光线对照。按品类分组，含中文提示词。颜色/形态/包装一致性是命门；食欲感镜头可夸张，功效宣称一个字不能有（合规参考 compliance.json 普通食品）。",
  "groups": {
    "热食": ["baking", "hotpot", "bbq", "noodle", "instant"],
    "甜点饮品": ["dessert", "chocolate", "coffee", "juice", "icecream"],
    "零食生鲜": ["snack", "sauce", "dairy", "fruit", "nuts"],
    "酒饮/其他": ["wine", "babyfood"]
  },
  "items": [
    {"id": "baking", "name": "烘焙面包/蛋糕", "group": "热食", "properties": "金黄酥脆，蓬松，热气", "scenes": ["烤箱旁", "午后阳光面包店", "早餐桌"], "light": "暖光+烤箱透光，金黄食欲感", "prompt_zh": "刚出炉的面包热气升腾，掰开拉丝绵密，金黄酥脆，暖光烘焙店氛围", "avoid": "颜色发灰/过焦；形态塌陷", "negative": ["颜色失真", "形态塌陷"], "tags": ["烘焙", "热气", "早餐"]},
    {"id": "hotpot", "name": "火锅/汤类", "group": "热食", "properties": "沸腾冒泡，热气蒸腾，食材丰富", "scenes": ["餐厅餐桌", "深夜食堂", "朋友聚餐"], "light": "暖色顶光+热气光柱，氛围热闹", "prompt_zh": "火锅汤底沸腾冒泡，热气蒸腾，食材翻滚，暖光聚餐氛围", "avoid": "汤底颜色失真；食材变形；飞溅夸张", "negative": ["汤色失真", "食材变形"], "tags": ["火锅", "热气", "聚餐"]},
    {"id": "bbq", "name": "烧烤/烤肉", "group": "热食", "properties": "炭火，油脂滋滋，焦香", "scenes": ["夜市", "户外烧烤", "居酒屋"], "light": "炭火暖光+烟熏氛围", "prompt_zh": "烤肉在炭火上滋滋冒油，表面焦香金黄，烟熏暖光夜市氛围", "avoid": "烤焦颜色失真；烟太浓盖食物", "negative": ["颜色失真", "烟雾过浓"], "tags": ["烧烤", "炭火", "夜市"]},
    {"id": "noodle", "name": "面条/粉面", "group": "热食", "properties": "筋道，汤汁，热气", "scenes": ["面馆", "深夜食堂", "家庭餐桌"], "light": "暖光+热气，市井烟火感", "prompt_zh": "面条筋道弹滑，筷子夹起热气腾腾，汤汁浓郁，暖光面馆氛围", "avoid": "面条形态错误；筷子变形", "negative": ["面条变形", "筷子变形"], "tags": ["面食", "热气", "烟火"]},
    {"id": "instant", "name": "速食/方便食品", "group": "热食", "properties": "冲泡过程，包装还原，便捷感", "scenes": ["办公室", "居家", "旅行"], "light": "日常光，真实感", "prompt_zh": "速食冲泡后热气升腾，面条还原筋道，办公桌日常光", "avoid": "包装与实物差距夸大；包装文字乱码", "negative": ["包装变形", "文字乱码"], "tags": ["速食", "便捷", "办公"]},
    {"id": "dessert", "name": "甜品/蛋糕", "group": "甜点饮品", "properties": "精致造型，奶油质感，马卡龙色", "scenes": ["甜品店", "下午茶", "花艺背景"], "light": "柔光+低饱和背景，精致感", "prompt_zh": "蛋糕奶油质感细腻，层次分明，精致摆盘，甜品店柔光", "avoid": "奶油融化变形；颜色过饱和", "negative": ["奶油变形", "过饱和"], "tags": ["甜品", "精致", "下午茶"]},
    {"id": "chocolate", "name": "巧克力", "group": "甜点饮品", "properties": "丝滑质感，深色光泽，掰开声", "scenes": ["深色丝绒背景", "暖光甜点店", "礼物场景"], "light": "深色背景+侧光，质感高级", "prompt_zh": "巧克力掰开丝滑断裂，深色光泽，暖光下质感高级", "avoid": "融化变形；颜色发灰", "negative": ["融化变形", "颜色失真"], "tags": ["巧克力", "质感", "礼物"]},
    {"id": "coffee", "name": "咖啡/茶饮", "group": "甜点饮品", "properties": "蒸汽，拉花，杯具质感", "scenes": ["咖啡馆", "晨光窗边", "办公桌"], "light": "窗光+蒸汽光柱，氛围惬意", "prompt_zh": "咖啡拉花细腻，蒸汽缓缓升腾，晨光咖啡馆窗边", "avoid": "蒸汽夸张；拉花变形；杯具文字乱码", "negative": ["蒸汽失真", "拉花变形"], "tags": ["咖啡", "蒸汽", "晨光"]},
    {"id": "juice", "name": "果汁/饮品", "group": "甜点饮品", "properties": "鲜亮颜色，冰块，水珠，清爽", "scenes": ["夏日阳光", "泳池边", "早餐桌"], "light": "明亮阳光+冰块折射，清爽感", "prompt_zh": "果汁颜色鲜亮，冰块碰撞水珠凝结，阳光下清爽透亮", "avoid": "颜色失真；冰块融化变形", "negative": ["颜色失真", "冰块变形"], "tags": ["饮品", "清爽", "夏季"]},
    {"id": "icecream", "name": "冰淇淋/雪糕", "group": "甜点饮品", "properties": "绵密，冷气，融化感", "scenes": ["甜品店", "夏日街头", "马卡龙色背景"], "light": "冷调柔光+马卡龙色，清新感", "prompt_zh": "冰淇淋绵密顺滑，冷气微微升腾，马卡龙色背景清新柔光", "avoid": "融化过快变形；颜色失真", "negative": ["融化变形", "颜色失真"], "tags": ["冰淇淋", "冷调", "夏季"]},
    {"id": "snack", "name": "零食/薯片", "group": "零食生鲜", "properties": "酥脆，包装，分享感", "scenes": ["居家沙发", "电视光", "野餐"], "light": "暖光+生活感，真实", "prompt_zh": "薯片酥脆掉渣，包装色彩鲜明，居家沙发暖光休闲氛围", "avoid": "包装文字乱码；碎屑夸张", "negative": ["包装变形", "文字乱码"], "tags": ["零食", "居家", "休闲"]},
    {"id": "sauce", "name": "酱料/调味品", "group": "零食生鲜", "properties": "浓稠，滴落质感，色泽", "scenes": ["厨房", "烧烤桌", "食材搭配"], "light": "厨房光+侧光，滴落质感清晰", "prompt_zh": "酱料浓稠缓缓滴落，色泽诱人，淋在食材上，厨房暖光", "avoid": "滴落形态生硬；色泽失真", "negative": ["滴落失真", "色泽失真"], "tags": ["酱料", "滴落", "厨房"]},
    {"id": "dairy", "name": "乳制品/酸奶", "group": "零食生鲜", "properties": "绵密，浓稠，晨光早餐感", "scenes": ["晨光早餐桌", "北欧厨房", "水果搭配"], "light": "晨光+柔光，清新自然", "prompt_zh": "酸奶绵密浓稠，倒出挂壁，晨光早餐桌清新氛围", "avoid": "质地错误（稀写成稠）；颜色失真", "negative": ["质地错误", "颜色失真"], "tags": ["乳制品", "早餐", "清新"]},
    {"id": "fruit", "name": "水果/生鲜", "group": "零食生鲜", "properties": "饱满，水珠，鲜亮，多汁", "scenes": ["市场", "自然光厨房", "夏日户外"], "light": "自然光+水珠反光，鲜嫩感", "prompt_zh": "水果饱满多汁，表皮水珠晶莹，自然光下鲜亮，切面汁水丰盈", "avoid": "切面氧化变灰；颜色失真", "negative": ["颜色失真", "切面氧化"], "tags": ["水果", "鲜嫩", "自然光"]},
    {"id": "nuts", "name": "坚果/干货", "group": "零食生鲜", "properties": "酥脆，纹理，木质质感", "scenes": ["木质背景", "暖光茶室", "原木餐桌"], "light": "暖光+侧光，纹理立体", "prompt_zh": "坚果纹理清晰，酥脆质感，暖光木质背景，自然健康感", "avoid": "纹理糊；颜色失真", "negative": ["纹理模糊", "颜色失真"], "tags": ["坚果", "纹理", "健康"]},
    {"id": "wine", "name": "酒类", "group": "酒饮/其他", "properties": "瓶身设计，液体通透，气泡/挂壁", "scenes": ["酒吧", "烛光餐桌", "玻璃杯特写"], "light": "逆光透酒液+烛光氛围", "prompt_zh": "酒液倒入杯中挂壁，气泡细密上升，烛光下玻璃杯通透", "avoid": "酒液颜色失真；标签乱码；未成年人形象", "negative": ["颜色失真", "标签乱码"], "tags": ["酒类", "氛围", "玻璃质感"]},
    {"id": "babyfood", "name": "婴幼儿辅食", "group": "酒饮/其他", "properties": "细腻质地，安全包装，温馨", "scenes": ["温馨居家", "宝宝餐椅", "柔光厨房"], "light": "柔光暖调，温馨安全感", "prompt_zh": "婴幼儿辅食质地细腻，勺起顺滑，温馨居家柔光氛围", "avoid": "功效宣称（助消化等禁止）；宝宝形象变形；夸张镜头", "negative": ["宝宝面部变形", "功效暗示"], "tags": ["婴幼儿", "温馨", "安全"]}
  ]
}
