{
  "schema_version": "1.0",
  "updated": "2026-08-07",
  "note": "个护×场景×光线对照（洗护/口腔/剃须）。包装/质地/泡沫一致性是命门；功效宣称需合规核。",
  "groups": {
    "洗护": ["shampoo", "bodywash"],
    "口腔": ["toothpaste", "toothbrush"],
    "剃须/其他": ["shaver", "feminine"]
  },
  "items": [
    {"id": "shampoo", "name": "洗发水/护发素", "group": "洗护", "properties": "液体质地，泡沫，瓶形包装", "scenes": ["浴室", "水汽", "晨光窗边"], "light": "浴室柔光+水汽，通透", "prompt_zh": "洗发水揉出绵密泡沫，水流冲洗发丝顺滑，浴室水汽柔光氛围", "avoid": "泡沫失真；瓶身变形；标签乱码", "negative": ["瓶身变形", "标签乱码", "泡沫失真"], "tags": ["洗发", "泡沫", "浴室"]},
    {"id": "bodywash", "name": "沐浴露", "group": "洗护", "properties": "啫喱质地，香气，泵头", "scenes": ["浴室", "浴缸", "水汽氛围"], "light": "柔光+水汽", "prompt_zh": "沐浴露啫喱质地顺滑，泵出泡沫丰盈，浴缸水汽柔光放松氛围", "avoid": "质地错误；泵头变形", "negative": ["质地错误"], "tags": ["沐浴", "水汽", "放松"]},
    {"id": "toothpaste", "name": "牙膏", "group": "口腔", "properties": "膏体条纹，管身包装，泡沫", "scenes": ["浴室镜前", "晨光洗漱", "牙刷特写"], "light": "浴室灯光+镜前光", "prompt_zh": "牙膏膏体条纹清晰，挤在牙刷上泡沫细腻，晨光浴室镜前", "avoid": "膏体条纹错乱；管身变形；功效夸大（美白需资质）", "negative": ["管身变形", "条纹错乱"], "tags": ["牙膏", "口腔", "晨间"]},
    {"id": "toothbrush", "name": "牙刷/电动牙刷", "group": "口腔", "properties": "刷头结构，握柄，声波科技", "scenes": ["浴室镜前", "旅行洗漱包", "晨光"], "light": "浴室光+镜面反光", "prompt_zh": "电动牙刷声波震动，刷头结构清晰，握柄质感，浴室镜前晨光", "avoid": "刷头变形；震动失真；logo错乱", "negative": ["刷头变形", "logo错乱"], "tags": ["牙刷", "电动", "口腔"]},
    {"id": "shaver", "name": "剃须刀", "group": "剃须/其他", "properties": "刀头结构，握持，金属质感", "scenes": ["浴室", "晨间洗漱", "旅行"], "light": "浴室光+金属反光", "prompt_zh": "剃须刀金属刀头质感，握持顺滑，晨间浴室光干净氛围", "avoid": "刀头变形；面部变形；剃须动作生硬", "negative": ["刀头变形", "面部变形"], "tags": ["剃须", "金属", "晨间"]},
    {"id": "feminine", "name": "女性护理/卫生用品", "group": "剃须/其他", "properties": "包装设计，柔和感，隐私性", "scenes": ["温馨居家", "浴室", "柔光卧室"], "light": "柔和暖光，私密温馨", "prompt_zh": "护理用品包装设计柔和，居家温馨柔光氛围，含蓄自然表达", "avoid": "画面过度直白；包装变形；功效夸大", "negative": ["包装变形"], "tags": ["护理", "温馨", "含蓄"]}
  ]
}
