{
  "schema_version": "1.0",
  "updated": "2026-08-07",
  "note": "3C数码×场景×光线对照。按品类分组，含中文提示词。logo/按键/屏幕/接口一致性是命门；参数演示不夸大（合规参考 compliance.json 3C数码）。",
  "groups": {
    "随身": ["phone", "earbuds", "watch", "powerbank"],
    "桌面": ["laptop", "keyboard", "monitor", "router", "desktop"],
    "影音娱乐": ["speaker", "console"],
    "拍摄/户外": ["camera", "drone"]
  },
  "items": [
    {"id": "phone", "name": "手机", "group": "随身", "properties": "外壳材质，屏幕，摄像头模组，logo", "scenes": ["极简桌面", "科技感背景", "夜景城市"], "light": "柔光+屏幕光，金属质感", "prompt_zh": "手机金属边框光泽流转，屏幕亮起显示清晰，极简桌面柔光", "avoid": "logo错乱；屏幕乱码；摄像头模组变形", "negative": ["logo错乱", "屏幕乱码", "外壳变形"], "tags": ["手机", "屏幕", "极简"]},
    {"id": "earbuds", "name": "耳机（头戴/入耳）", "group": "随身", "properties": "腔体设计，耳罩材质，logo", "scenes": ["音乐氛围", "霓虹夜晚", "极简桌面"], "light": "氛围光+霓虹，音乐感", "prompt_zh": "头戴耳机皮质耳罩质感柔软，金属支架光泽，霓虹音乐氛围", "avoid": "腔体变形；logo错乱；佩戴时耳部变形", "negative": ["腔体变形", "logo错乱"], "tags": ["耳机", "音乐", "霓虹"]},
    {"id": "watch", "name": "智能手表", "group": "随身", "properties": "表盘，表带材质，屏幕显示", "scenes": ["运动场景", "户外", "晨光手腕特写"], "light": "自然光+屏幕亮光", "prompt_zh": "智能手表表盘显示清晰，金属表身质感，运动后晨光手腕特写", "avoid": "表盘界面乱码；表带变形；手腕变形", "negative": ["表盘乱码", "表带变形"], "tags": ["手表", "运动", "屏幕"]},
    {"id": "powerbank", "name": "充电宝/充电器", "group": "随身", "properties": "外壳，接口，指示灯，电量显示", "scenes": ["旅行", "桌面", "机场"], "light": "日常光，指示灯亮光", "prompt_zh": "充电宝金属外壳质感，指示灯亮起，旅行场景日常光", "avoid": "接口错位；指示灯变形；logo错乱", "negative": ["接口错位", "logo错乱"], "tags": ["充电", "便携", "桌面"]},
    {"id": "laptop", "name": "笔记本/平板", "group": "桌面", "properties": "开合结构，屏幕，键盘，金属外壳", "scenes": ["办公室", "极简桌面", "咖啡馆"], "light": "窗光+屏幕光，商务感", "prompt_zh": "笔记本开合流畅，屏幕亮起，金属外壳磨砂质感，窗光办公桌", "avoid": "屏幕乱码；键盘变形；外壳材质错误", "negative": ["屏幕乱码", "键盘变形"], "tags": ["笔记本", "办公", "屏幕"]},
    {"id": "keyboard", "name": "键盘/外设", "group": "桌面", "properties": "键帽，轴体手感，RGB光效", "scenes": ["电竞房", "RGB光效", "极简桌面"], "light": "RGB氛围光，科技感", "prompt_zh": "机械键盘键帽质感清晰，RGB光效流动，电竞房氛围光", "avoid": "键帽错乱；灯光过曝；字迹乱码", "negative": ["键帽错乱", "字迹乱码"], "tags": ["键盘", "电竞", "RGB"]},
    {"id": "monitor", "name": "显示器", "group": "桌面", "properties": "屏幕色彩，边框，支架", "scenes": ["电竞房", "办公桌", "极简空间"], "light": "屏幕光+环境柔光", "prompt_zh": "显示器色彩饱满细腻，窄边框设计，极简电竞房环境光", "avoid": "屏幕坏点/乱码；色彩失真；边框变形", "negative": ["屏幕乱码", "色彩失真"], "tags": ["显示器", "屏幕", "电竞"]},
    {"id": "router", "name": "路由器/智能家居", "group": "桌面", "properties": "天线，指示灯，简约设计", "scenes": ["居家", "极简玄关", "书房"], "light": "日常柔光，指示灯点缀", "prompt_zh": "路由器简约设计，指示灯呼吸闪烁，极简书房柔光", "avoid": "天线变形；指示灯异常；logo错乱", "negative": ["天线变形", "logo错乱"], "tags": ["路由器", "智能家居", "极简"]},
    {"id": "desktop", "name": "台式机/主机", "group": "桌面", "properties": "机箱，RGB光效，侧透玻璃", "scenes": ["电竞房", "桌面", "RGB氛围"], "light": "RGB光效，科技感", "prompt_zh": "主机侧透玻璃内RGB光效流动，金属机箱质感，电竞房氛围", "avoid": "机箱变形；光效过曝；内部结构乱", "negative": ["机箱变形", "光效过曝"], "tags": ["主机", "电竞", "RGB"]},
    {"id": "speaker", "name": "音箱", "group": "影音娱乐", "properties": "织物/金属网罩，音腔设计，品牌质感", "scenes": ["居家客厅", "木质家居", "暖光氛围"], "light": "暖光+柔光，居家质感", "prompt_zh": "音箱织物网罩质感细腻，金属底座光泽，木质家居暖光氛围", "avoid": "网罩纹理乱；logo错乱", "negative": ["网罩变形", "logo错乱"], "tags": ["音箱", "居家", "质感"]},
    {"id": "console", "name": "游戏机", "group": "影音娱乐", "properties": "主机造型，手柄，屏幕画面", "scenes": ["客厅", "游戏房", "霓虹氛围"], "light": "屏幕光+霓虹氛围", "prompt_zh": "游戏机手柄握持舒适，屏幕画面流畅，霓虹客厅游戏氛围", "avoid": "手柄变形；画面乱码；logo错乱", "negative": ["手柄变形", "画面乱码"], "tags": ["游戏机", "客厅", "游戏"]},
    {"id": "camera", "name": "相机", "group": "拍摄/户外", "properties": "机身，镜头玻璃，转盘，皮革饰皮", "scenes": ["旅行", "咖啡馆", "户外"], "light": "自然光+镜头反光，器材感", "prompt_zh": "相机机身复古皮革质感，镜头玻璃反光，旅行咖啡馆自然光", "avoid": "镜头玻璃变形；机身logo错乱；转盘错位", "negative": ["镜头变形", "logo错乱"], "tags": ["相机", "旅行", "复古"]},
    {"id": "drone", "name": "无人机", "group": "拍摄/户外", "properties": "机臂，旋翼，摄像头云台", "scenes": ["户外天空", "山顶", "航拍"], "light": "自然光+天空，开阔感", "prompt_zh": "无人机机臂展开，旋翼转动，云台摄像头稳定，山顶自然光航拍", "avoid": "旋翼变形；机臂错位；云台乱", "negative": ["旋翼变形", "机臂错位"], "tags": ["无人机", "航拍", "户外"]}
  ]
}
