{
  "schema_version": "1.0",
  "updated": "2026-08-07",
  "note": "配饰×场景×光线对照（帽/围巾/腰带/眼镜/丝巾）。造型/花纹/logo一致性是命门。",
  "groups": {
    "头饰": ["cap", "beanie", "scarf"],
    "腰饰": ["belt"],
    "眼镜/其他": ["glasses", "silk_scarf"]
  },
  "items": [
    {"id": "cap", "name": "棒球帽", "group": "头饰", "properties": "帽型，刺绣logo，配色", "scenes": ["街头", "球场", "滑板场"], "light": "自然光+硬光可选，街头感", "prompt_zh": "棒球帽帽型挺括，刺绣logo清晰，街头自然光潮感氛围", "avoid": "帽型塌；logo刺绣错乱", "negative": ["帽型塌陷", "logo错乱"], "tags": ["帽子", "街头", "logo"]},
    {"id": "beanie", "name": "针织帽/毛线帽", "group": "头饰", "properties": "针织纹理，弹性，卷边", "scenes": ["冬日街头", "雪山", "咖啡馆"], "light": "暖光+冷环境对比", "prompt_zh": "毛线帽针织纹理清晰，戴上温暖，冬日街头暖光氛围", "avoid": "针法错乱；头型变形", "negative": ["针织纹路错乱"], "tags": ["毛线帽", "冬日", "温暖"]},
    {"id": "scarf", "name": "围巾", "group": "头饰", "properties": "羊毛/羊绒，垂坠，格纹", "scenes": ["冬夜街头", "雪景", "围炉"], "light": "暖光+低照度", "prompt_zh": "羊毛围巾柔软垂坠，佩戴后随动作自然摆动，冬夜街角暖光", "avoid": "格纹错乱；垂坠生硬", "negative": ["格纹错乱"], "tags": ["围巾", "冬日", "垂坠"]},
    {"id": "belt", "name": "腰带", "group": "腰饰", "properties": "皮质，带扣五金，纹理", "scenes": ["穿搭展示", "通勤", "牛仔搭配"], "light": "侧光突出皮革纹理", "prompt_zh": "腰带皮质纹理细腻，金属带扣光泽，侧光穿搭特写", "avoid": "带扣变形；皮纹糊；扣眼错乱", "negative": ["带扣变形", "纹理模糊"], "tags": ["腰带", "皮质", "细节"]},
    {"id": "glasses", "name": "眼镜（太阳镜/光学镜）", "group": "眼镜/其他", "properties": "镜框材质，镜片颜色，logo", "scenes": ["海边", "街头", "夏日"], "light": "明亮阳光+镜片反光", "prompt_zh": "太阳镜镜框质感高级，镜片反光自然，海边阳光夏日氛围", "avoid": "镜框变形；镜片反光失真；面部变形", "negative": ["镜框变形", "面部变形"], "tags": ["眼镜", "夏日", "反光"]},
    {"id": "silk_scarf", "name": "丝巾", "group": "眼镜/其他", "properties": "真丝，印花，飘逸", "scenes": ["法式街头", "花园", "颈间/发间"], "light": "柔光+风，飘逸感", "prompt_zh": "真丝丝巾印花精致，随风轻扬，法式街角柔光优雅氛围", "avoid": "印花错乱；飘动生硬", "negative": ["印花错乱"], "tags": ["丝巾", "法式", "飘逸"]}
  ]
}
