{
  "schema_version": "1.0",
  "updated": "2026-08-07",
  "note": "美妆×场景×光线对照。按产品类型分组，含中文提示词。色号/包装/质地一致性是命门（参考 category-profiles.json beauty profile）。",
  "groups": {
    "彩妆": [
      "lipstick",
      "foundation",
      "eyeshadow",
      "eyeliner",
      "blush",
      "nail"
    ],
    "护肤": [
      "serum",
      "mask",
      "sunscreen",
      "cleanser",
      "bodylotion",
      "menscare"
    ],
    "香氛/其他": [
      "perfume",
      "giftbox",
      "tool"
    ]
  },
  "items": [
    {
      "id": "lipstick",
      "name": "口红/唇釉",
      "group": "彩妆",
      "properties": "膏体/液体，色号是命门，丝绒哑光或水光",
      "scenes": [
        "梳妆台镜前",
        "都市夜景",
        "试色特写"
      ],
      "light": "柔光箱+镜前灯，试色需中性白光保证色准",
      "prompt_zh": "口红膏体顺滑推开，正红色在唇上均匀显色，丝绒哑光质地，镜前柔光",
      "avoid": "色号偏移；膏体变形；试色光要中性白光，暖光会偏色",
      "negative": [
        "色号偏移",
        "膏体变形",
        "唇部变形"
      ],
      "tags": [
        "彩妆",
        "唇部",
        "色号敏感"
      ]
    },
    {
      "id": "foundation",
      "name": "粉底/气垫",
      "group": "彩妆",
      "properties": "液/霜/粉状，色号与肤质贴合，妆效（雾面/水光）",
      "scenes": [
        "化妆台",
        "浴室窗光",
        "晨光卧室"
      ],
      "light": "大面积柔光窗光，肤色自然",
      "prompt_zh": "粉底液在脸颊均匀推开，轻薄服帖，自然雾面妆效，柔和窗光",
      "avoid": "假面感/卡粉；色号与肤色不匹配；妆效别夸大",
      "negative": [
        "假面感",
        "卡粉",
        "色号不匹配"
      ],
      "tags": [
        "底妆",
        "肤色",
        "妆效"
      ]
    },
    {
      "id": "eyeshadow",
      "name": "眼影盘",
      "group": "彩妆",
      "properties": "粉质/膏状，配色盘面，珠光/哑光",
      "scenes": [
        "梳妆台",
        "舞台后台",
        "灯光氛围"
      ],
      "light": "化妆镜灯+柔光，显色清晰",
      "prompt_zh": "眼影盘珠光粉质细腻，刷子蘸取显色，眼妆层次分明，化妆镜灯光",
      "avoid": "盘面色块错乱；粉质纹理糊；飞粉夸张",
      "negative": [
        "色块错乱",
        "粉质模糊"
      ],
      "tags": [
        "彩妆",
        "眼部",
        "配色"
      ]
    },
    {
      "id": "eyeliner",
      "name": "眼线笔/睫毛膏",
      "group": "彩妆",
      "properties": "笔状/刷状，线条流畅度，防水宣称需合规",
      "scenes": [
        "化妆镜前特写",
        "浴室",
        "通勤晨间"
      ],
      "light": "镜前柔光，眼部特写清晰",
      "prompt_zh": "眼线笔一笔流畅勾勒，线条细腻不晕染，眼部特写，柔和镜前光",
      "avoid": "手部/眼部变形；线条抖动；防水宣称镜头别过度",
      "negative": [
        "手部变形",
        "眼部变形",
        "线条断裂"
      ],
      "tags": [
        "彩妆",
        "眼部",
        "线条"
      ]
    },
    {
      "id": "blush",
      "name": "腮红/高光",
      "group": "彩妆",
      "properties": "粉质细腻，妆效（自然/光泽）",
      "scenes": [
        "花园",
        "自然窗光",
        "户外晨光"
      ],
      "light": "自然散射光，妆效真实",
      "prompt_zh": "腮红轻扫脸颊，自然红润，细腻粉质，花园自然光",
      "avoid": "妆效夸张到修图感",
      "negative": [
        "妆效夸张",
        "粉质粗糙"
      ],
      "tags": [
        "彩妆",
        "自然",
        "气色"
      ]
    },
    {
      "id": "nail",
      "name": "指甲油",
      "group": "彩妆",
      "properties": "液体/胶状，颜色饱和，光泽",
      "scenes": [
        "窗光手部特写",
        "美甲台",
        "夏日海边"
      ],
      "light": "柔光+窗光，甲面光泽",
      "prompt_zh": "指甲油均匀涂抹，甲面饱满光泽，手部特写，柔和窗光",
      "avoid": "手部变形；甲面气泡/不均",
      "negative": [
        "手部变形",
        "甲面不均"
      ],
      "tags": [
        "彩妆",
        "手部",
        "色彩"
      ]
    },
    {
      "id": "serum",
      "name": "精华/面霜",
      "group": "护肤",
      "properties": "液体/霜状，质地（清爽/滋润），吸收感",
      "scenes": [
        "浴室水汽",
        "晨光卧室",
        "梳妆台"
      ],
      "light": "柔和晨光+水汽氛围，质感通透",
      "prompt_zh": "精华液质地清透，涂抹后肌肤水润光泽，晨光浴室氛围",
      "avoid": "质地错误（清爽写成油腻）；功效宣称合规（不写抗皱淡斑无资质）",
      "negative": [
        "质地错误",
        "假滑感"
      ],
      "tags": [
        "护肤",
        "质地",
        "水润"
      ]
    },
    {
      "id": "mask",
      "name": "面膜",
      "group": "护肤",
      "properties": "贴片/涂抹，贴合感，精华量",
      "scenes": [
        "居家沙发",
        "浴缸",
        "睡前卧室"
      ],
      "light": "柔和暖光，放松氛围",
      "prompt_zh": "面膜贴合面部，精华液丰盈，放松居家氛围，柔和暖光",
      "avoid": "面膜边缘翘起不贴合；面部变形",
      "negative": [
        "面膜不贴合",
        "面部变形"
      ],
      "tags": [
        "护肤",
        "居家",
        "放松"
      ]
    },
    {
      "id": "sunscreen",
      "name": "防晒",
      "group": "护肤",
      "properties": "乳/喷雾，防晒值宣称需资质，清爽不黏腻",
      "scenes": [
        "海边",
        "户外",
        "夏日街头"
      ],
      "light": "明亮阳光（注意防晒镜头与光自洽）",
      "prompt_zh": "防晒乳清爽推开不黏腻，海边阳光下肌肤自然，轻盈质地",
      "avoid": "防晒值/防水宣称需客户提供资质；别拍成晒黑",
      "negative": [
        "黏腻感",
        "质地厚重"
      ],
      "tags": [
        "护肤",
        "户外",
        "夏季"
      ]
    },
    {
      "id": "cleanser",
      "name": "卸妆/洁面",
      "group": "护肤",
      "properties": "液/膏/泡沫，清洁力展示，温和",
      "scenes": [
        "浴室",
        "夜间洗漱",
        "镜前"
      ],
      "light": "浴室灯光，水汽氛围",
      "prompt_zh": "洁面乳揉出绵密泡沫，温和清洁，浴室水汽灯光",
      "avoid": "泡沫形态夸张；过度清洁暗示",
      "negative": [
        "泡沫失真"
      ],
      "tags": [
        "护肤",
        "清洁",
        "浴室"
      ]
    },
    {
      "id": "bodylotion",
      "name": "身体乳",
      "group": "护肤",
      "properties": "乳状，滋润感，吸收",
      "scenes": [
        "浴后卧室",
        "暖光浴室",
        "晨光床边"
      ],
      "light": "暖光，氛围私密",
      "prompt_zh": "身体乳涂抹后肌肤滋润光泽，浴后暖光卧室氛围",
      "avoid": "功效宣称（美白/紧致需资质）",
      "negative": [
        "油腻感"
      ],
      "tags": [
        "护肤",
        "身体",
        "滋润"
      ]
    },
    {
      "id": "menscare",
      "name": "男士护肤",
      "group": "护肤",
      "properties": "清爽质地，简约包装，功能（控油/保湿）",
      "scenes": [
        "浴室冷调",
        "健身房",
        "晨间洗漱"
      ],
      "light": "冷调自然光，清爽感",
      "prompt_zh": "男士洁面泡沫清爽，冷调浴室光，简约质感包装",
      "avoid": "过度修饰男性形象；功效宣称需资质",
      "negative": [
        "油腻感"
      ],
      "tags": [
        "护肤",
        "男士",
        "清爽"
      ]
    },
    {
      "id": "perfume",
      "name": "香水",
      "group": "香氛/其他",
      "properties": "瓶身设计是重点，液体通透，喷雾氛围",
      "scenes": [
        "花丛",
        "法式公寓",
        "卧室晨光",
        "礼物场景"
      ],
      "light": "侧逆光透瓶身，氛围光",
      "prompt_zh": "香水瓶身晶莹通透，喷雾在光中散开，法式公寓晨光氛围",
      "avoid": "瓶身变形；液体颜色失真；文字标签乱码",
      "negative": [
        "瓶身变形",
        "标签乱码"
      ],
      "tags": [
        "香氛",
        "瓶身",
        "氛围"
      ]
    },
    {
      "id": "giftbox",
      "name": "彩妆礼盒",
      "group": "香氛/其他",
      "properties": "礼盒包装，开盒仪式感，丝带",
      "scenes": [
        "礼物场景",
        "节日氛围",
        "丝带特写"
      ],
      "light": "暖光+柔和主光，仪式感",
      "prompt_zh": "彩妆礼盒丝带解开，盒内产品排列精致，暖光节日氛围",
      "avoid": "盒内产品错乱；文字乱码",
      "negative": [
        "包装变形",
        "文字乱码"
      ],
      "tags": [
        "礼盒",
        "节日",
        "仪式感"
      ]
    },
    {
      "id": "tool",
      "name": "美妆工具（刷具）",
      "group": "香氛/其他",
      "properties": "刷毛质感，握柄设计",
      "scenes": [
        "化妆台",
        "极简桌面",
        "晨光"
      ],
      "light": "柔光，刷毛细节清晰",
      "prompt_zh": "化妆刷毛尖柔软细腻，握柄质感高级，化妆台柔光特写",
      "avoid": "刷毛形态错误",
      "negative": [
        "刷毛变形"
      ],
      "tags": [
        "工具",
        "细节",
        "极简"
      ]
    }
  ]
}